{
  "application": {
    "name": "app",
    "datetime": "2016-04-05T18:25:43.511Z",
    "startup": "2016-04-05T18:25:43.511Z",
    "uptime": "11 days, 14:22:25.12345",
    "hostname": "app.organization.com",
    "version": "1.2.3"
  },
  "health": {
    "databases": true,
    "integrationpoints": true,
    "circuitbreakers": true,
    "filesystem": true
  },
  "databases": [
    {
      "name": "postgres",
      "health": true,
      "essential": true,
      "latency": 0.4,
      "connections": 10
    },
    {
      "name": "redis",
      "essential": false,
      "health": true,
      "latency": 0.2,
      "connections": 1
    }
  ],
  "integrationpoints": [
    {
      "name": "google-maps-api",
      "essential": false,
      "health": true,
      "latency": 22.5
    }
  ],
  "circuitbreakers": [
    {
      "name": "authenticator",
      "essential": true,
      "state": "closed",
      "health": true,
      "latency": 4.7,
      "timeout": "2016-04-05T18:25:43.511Z"
    }
  ],
  "filesystems": [
    {
      "name": "/data",
      "essential": true,
      "health": true,
      "readable": true,
      "writable": true,
      "latency": 0.75,
      "timeout": "2016-04-05T18:25:43.511Z"
    }
  ]
}
